"Describe the difference between these two audios. If there is no difference, say as much.",Do you believe you listened to a watermarked audio?
"In audio 2, there is a slight bit of static in the background, as opposed to audio 1.",Yes
The first one sounds like it has more reverb and has the solos turned up. The second seemed more strongly tuned to a key,No
I can't tell the difference,No
Sound the same ,No
I can't notice a difference,Unsure
"the second one is less crisp, more grainy ig",Unsure
Audio 2 has static and noise. Volume seems lower and audio seems compressed overall,Yes
"Audio 2 sounds more static and fuzzy, especially the bass",Yes
significant static,Yes
"There's a low static/crumbling in audio2, sounds like when you don't plug in your headphones the whole way",Yes
There was a staticy background present in the second audio,Yes
Do not believe there is a noticeable difference,No
"audio 2 sounded more warbly, more static",Yes
I believe there is a low level of constant distortion in the background on audio 2,Yes
none,No
No difference,No
audio 2 makes me sad for some reason,Yes
"Audio 2 is somehow less ""smooth""; there is a little bit of a ""buzz"" under the audio throughout and the volume seems slightly different towards the end.",Yes
Doesn’t seem to be different!,Unsure
The second audio file seemed to have a popping noise in the background. ,Unsure
This might have not been intetional but the 2nd audio had artifacting throughout the song,No
"I can’t really tell a difference. Maybe a subtle difference in instrument or something behind the scenes, but I’m not hearing an obvious watermarked thing. I was almost expecting a one second vocal tag or something. But nothing that’s jumping out at me ",Unsure
"at some points in audio 2 i thought i heard something static-y or crackly, but i don't think i noticed a difference other than that",Yes
No difference ,No
The man and the woman both sing at the same times in both audios but i want to say the second sounded a bit different like maybe faster and ended more abruptly ,Unsure
"Audio 2 had some sort of quantization or sampling error, emblematic of receiving a text message around computer speakers in mid 2000s.",Unsure
